{
  "curves": [
    {
      "name": "Forward current as a function of forward voltage, Tamb = 25 degC trace",
      "page_reference": "p. 3 fig. 1",
      "points": [
        {
          "x": 0.5,
          "y": 0.0001
        },
        {
          "x": 0.58,
          "y": 0.001
        },
        {
          "x": 0.66,
          "y": 0.01
        },
        {
          "x": 0.74,
          "y": 0.05
        },
        {
          "x": 0.84,
          "y": 0.1
        },
        {
          "x": 1.0,
          "y": 0.2
        }
      ],
      "test_conditions": "Typical values, Tamb = 25 degC, curve (3)",
      "x_axis": {
        "quantity": "Forward voltage",
        "scale": "linear",
        "unit": "V"
      },
      "y_axis": {
        "quantity": "Forward current",
        "scale": "log",
        "unit": "A"
      }
    }
  ],
  "datasheet_identity": {
    "pages_examined": [
      "p. 1",
      "p. 2",
      "p. 3",
      "p. 4",
      "p. 5",
      "p. 6",
      "p. 7",
      "p. 8"
    ],
    "revision": "BAS16J v.7, 1 October 2022",
    "title": "BAS16J - High-speed switching diode"
  },
  "extraction_notes": [
    "Forward I-V points were manually digitized from the Tamb = 25 degC typical trace on p. 3 fig. 1.",
    "Reverse current and capacitance entries use the stated maximum values from table 7.",
    "Reverse recovery time is a maximum measured with the table 7 test circuit conditions."
  ],
  "family": "diode",
  "manufacturer": "Nexperia",
  "mpn": "BAS16J,135",
  "omission_reason": null,
  "schema_version": "1.0.0",
  "specs": {
    "breakdown_current": null,
    "breakdown_voltage": null,
    "capacitance": {
      "conditions": "VR = 0 V, f = 1 MHz, Tamb = 25 degC",
      "page_reference": "p. 3 table 7 characteristics",
      "source_kind": "maximum",
      "unit": "F",
      "value": 1.5e-12
    },
    "forward_voltage_points": [
      {
        "current": {
          "conditions": "IF = 1 mA, tp <= 300 us, delta <= 0.02, pulsed, Tamb = 25 degC",
          "page_reference": "p. 3 table 7 characteristics",
          "source_kind": "maximum",
          "unit": "A",
          "value": 0.001
        },
        "voltage": {
          "conditions": "IF = 1 mA, tp <= 300 us, delta <= 0.02, pulsed, Tamb = 25 degC",
          "page_reference": "p. 3 table 7 characteristics",
          "source_kind": "maximum",
          "unit": "V",
          "value": 0.715
        }
      },
      {
        "current": {
          "conditions": "IF = 10 mA, tp <= 300 us, delta <= 0.02, pulsed, Tamb = 25 degC",
          "page_reference": "p. 3 table 7 characteristics",
          "source_kind": "maximum",
          "unit": "A",
          "value": 0.01
        },
        "voltage": {
          "conditions": "IF = 10 mA, tp <= 300 us, delta <= 0.02, pulsed, Tamb = 25 degC",
          "page_reference": "p. 3 table 7 characteristics",
          "source_kind": "maximum",
          "unit": "V",
          "value": 0.855
        }
      },
      {
        "current": {
          "conditions": "IF = 50 mA, tp <= 300 us, delta <= 0.02, pulsed, Tamb = 25 degC",
          "page_reference": "p. 3 table 7 characteristics",
          "source_kind": "maximum",
          "unit": "A",
          "value": 0.05
        },
        "voltage": {
          "conditions": "IF = 50 mA, tp <= 300 us, delta <= 0.02, pulsed, Tamb = 25 degC",
          "page_reference": "p. 3 table 7 characteristics",
          "source_kind": "maximum",
          "unit": "V",
          "value": 1.0
        }
      },
      {
        "current": {
          "conditions": "IF = 150 mA, tp <= 300 us, delta <= 0.02, pulsed, Tamb = 25 degC",
          "page_reference": "p. 3 table 7 characteristics",
          "source_kind": "maximum",
          "unit": "A",
          "value": 0.15
        },
        "voltage": {
          "conditions": "IF = 150 mA, tp <= 300 us, delta <= 0.02, pulsed, Tamb = 25 degC",
          "page_reference": "p. 3 table 7 characteristics",
          "source_kind": "maximum",
          "unit": "V",
          "value": 1.25
        }
      }
    ],
    "reverse_current": {
      "conditions": "VR = 80 V, Tamb = 25 degC",
      "page_reference": "p. 3 table 7 characteristics",
      "source_kind": "maximum",
      "unit": "A",
      "value": 5e-07
    },
    "reverse_recovery": {
      "conditions": "IF = 10 mA, IR = 10 mA, RL = 100 ohm, IR(meas) = 1 mA, Tamb = 25 degC",
      "page_reference": "p. 3 table 7 characteristics",
      "source_kind": "maximum",
      "unit": "s",
      "value": 4e-09
    },
    "variant": "signal"
  },
  "usable_curves": true
}
