{
  "schema_version": "1.0.0",
  "mpn": "B5819W",
  "manufacturer": "MDD Microdiode Semiconductor",
  "family": "diode",
  "datasheet_identity": {
    "title": "B5817W THRU B5819W SCHOTTKY DIODES",
    "revision": "Rev:2025A4",
    "pages_examined": [
      "p. 1",
      "p. 2",
      "p. 3"
    ]
  },
  "usable_curves": true,
  "curves": [
    {
      "name": "Forward characteristics at Ta = 25 degC",
      "x_axis": {
        "quantity": "forward voltage",
        "unit": "V",
        "scale": "linear"
      },
      "y_axis": {
        "quantity": "forward current",
        "unit": "A",
        "scale": "log"
      },
      "test_conditions": "Pulsed typical characteristics for B5819W, Ta = 25 degC",
      "page_reference": "p. 2, Typical Characteristics, Forward Characteristics",
      "points": [
        {
          "x": 0.34,
          "y": 0.1
        },
        {
          "x": 0.51,
          "y": 1.0
        },
        {
          "x": 0.69,
          "y": 2.0
        },
        {
          "x": 0.88,
          "y": 3.0
        },
        {
          "x": 1.08,
          "y": 5.0
        },
        {
          "x": 1.45,
          "y": 8.0
        }
      ]
    },
    {
      "name": "Forward characteristics at Ta = 100 degC",
      "x_axis": {
        "quantity": "forward voltage",
        "unit": "V",
        "scale": "linear"
      },
      "y_axis": {
        "quantity": "forward current",
        "unit": "A",
        "scale": "log"
      },
      "test_conditions": "Pulsed typical characteristics for B5819W, Ta = 100 degC",
      "page_reference": "p. 2, Typical Characteristics, Forward Characteristics",
      "points": [
        {
          "x": 0.25,
          "y": 0.1
        },
        {
          "x": 0.43,
          "y": 1.0
        },
        {
          "x": 0.58,
          "y": 2.0
        },
        {
          "x": 0.72,
          "y": 3.0
        },
        {
          "x": 1.0,
          "y": 5.0
        },
        {
          "x": 1.42,
          "y": 8.0
        }
      ]
    },
    {
      "name": "Reverse characteristics at Ta = 25 degC",
      "x_axis": {
        "quantity": "reverse voltage",
        "unit": "V",
        "scale": "linear"
      },
      "y_axis": {
        "quantity": "reverse current",
        "unit": "A",
        "scale": "log"
      },
      "test_conditions": "Pulsed typical characteristics for B5819W, Ta = 25 degC",
      "page_reference": "p. 2, Typical Characteristics, Reverse Characteristics",
      "points": [
        {
          "x": 1.0,
          "y": 4.5e-6
        },
        {
          "x": 10.0,
          "y": 8.0e-6
        },
        {
          "x": 20.0,
          "y": 1.2e-5
        },
        {
          "x": 30.0,
          "y": 1.8e-5
        },
        {
          "x": 40.0,
          "y": 3.2e-5
        }
      ]
    },
    {
      "name": "Reverse characteristics at Ta = 75 degC",
      "x_axis": {
        "quantity": "reverse voltage",
        "unit": "V",
        "scale": "linear"
      },
      "y_axis": {
        "quantity": "reverse current",
        "unit": "A",
        "scale": "log"
      },
      "test_conditions": "Pulsed typical characteristics for B5819W, Ta = 75 degC",
      "page_reference": "p. 2, Typical Characteristics, Reverse Characteristics",
      "points": [
        {
          "x": 1.0,
          "y": 5.0e-5
        },
        {
          "x": 10.0,
          "y": 8.0e-5
        },
        {
          "x": 20.0,
          "y": 1.1e-4
        },
        {
          "x": 30.0,
          "y": 1.6e-4
        },
        {
          "x": 40.0,
          "y": 2.6e-4
        }
      ]
    },
    {
      "name": "Reverse characteristics at Ta = 100 degC",
      "x_axis": {
        "quantity": "reverse voltage",
        "unit": "V",
        "scale": "linear"
      },
      "y_axis": {
        "quantity": "reverse current",
        "unit": "A",
        "scale": "log"
      },
      "test_conditions": "Pulsed typical characteristics for B5819W, Ta = 100 degC",
      "page_reference": "p. 2, Typical Characteristics, Reverse Characteristics",
      "points": [
        {
          "x": 1.0,
          "y": 4.0e-4
        },
        {
          "x": 10.0,
          "y": 7.0e-4
        },
        {
          "x": 20.0,
          "y": 1.0e-3
        },
        {
          "x": 30.0,
          "y": 1.4e-3
        },
        {
          "x": 40.0,
          "y": 2.3e-3
        }
      ]
    },
    {
      "name": "Junction capacitance characteristics",
      "x_axis": {
        "quantity": "reverse voltage",
        "unit": "V",
        "scale": "linear"
      },
      "y_axis": {
        "quantity": "junction capacitance",
        "unit": "F",
        "scale": "linear"
      },
      "test_conditions": "Typical characteristics, Ta = 25 degC, f = 1 MHz",
      "page_reference": "p. 2, Typical Characteristics, Capacitance Characteristics",
      "points": [
        {
          "x": 0.0,
          "y": 3.3e-10
        },
        {
          "x": 1.0,
          "y": 2.0e-10
        },
        {
          "x": 2.0,
          "y": 1.55e-10
        },
        {
          "x": 4.0,
          "y": 1.2e-10
        },
        {
          "x": 8.0,
          "y": 7.5e-11
        },
        {
          "x": 12.0,
          "y": 6.2e-11
        },
        {
          "x": 16.0,
          "y": 5.2e-11
        },
        {
          "x": 20.0,
          "y": 4.5e-11
        }
      ]
    }
  ],
  "specs": {
    "variant": "schottky",
    "forward_voltage_points": [
      {
        "current": {
          "value": 1.0,
          "unit": "A",
          "conditions": "Ta = 25 degC",
          "page_reference": "p. 1, Characteristics at Ta = 25 degC, Maximum Forward Voltage",
          "source_kind": "maximum"
        },
        "voltage": {
          "value": 0.6,
          "unit": "V",
          "conditions": "IF = 1 A, Ta = 25 degC",
          "page_reference": "p. 1, Characteristics at Ta = 25 degC, Maximum Forward Voltage",
          "source_kind": "maximum"
        }
      },
      {
        "current": {
          "value": 3.0,
          "unit": "A",
          "conditions": "Ta = 25 degC",
          "page_reference": "p. 1, Characteristics at Ta = 25 degC, Maximum Forward Voltage",
          "source_kind": "maximum"
        },
        "voltage": {
          "value": 0.9,
          "unit": "V",
          "conditions": "IF = 3 A, Ta = 25 degC",
          "page_reference": "p. 1, Characteristics at Ta = 25 degC, Maximum Forward Voltage",
          "source_kind": "maximum"
        }
      }
    ],
    "reverse_current": {
      "value": 0.001,
      "unit": "A",
      "conditions": "VR = 20 V, Tj = 25 degC",
      "page_reference": "p. 1, Characteristics at Ta = 25 degC, Peak Reverse Current",
      "source_kind": "maximum"
    },
    "capacitance": {
      "value": 1.1e-10,
      "unit": "F",
      "conditions": "Ta = 25 degC, f = 1 MHz; applied reverse voltage is not specified for the 110 pF table value",
      "page_reference": "p. 1, Characteristics at Ta = 25 degC, Typical Junction Capacitance; p. 2 capacitance plot",
      "source_kind": "typical"
    },
    "reverse_recovery": null,
    "breakdown_voltage": {
      "value": 40.0,
      "unit": "V",
      "conditions": "IR = 1 mA, Ta = 25 degC",
      "page_reference": "p. 1, Characteristics at Ta = 25 degC, Reverse Breakdown Voltage",
      "source_kind": "minimum"
    },
    "breakdown_current": {
      "value": 0.001,
      "unit": "A",
      "conditions": "Test current for the reverse breakdown voltage specification, Ta = 25 degC",
      "page_reference": "p. 1, Characteristics at Ta = 25 degC, Reverse Breakdown Voltage",
      "source_kind": "typical"
    }
  },
  "extraction_notes": [
    "The datasheet covers B5817W through B5819W; the extracted device is the B5819W column and its page 2 typical-characteristics plots.",
    "Page 2 plots are marked typical and reference only. Curve points are direct digitizations of visible plotted grid crossings; no intermediate points were interpolated.",
    "The 110 pF typical junction-capacitance table value does not state an applied reverse voltage; the page 2 capacitance plot states Ta = 25 degC and f = 1 MHz.",
    "No reverse-recovery time (trr) is published in the supplied datasheet."
  ],
  "omission_reason": null
}
